Text,label
好 大米粥 黄黄 颜色 很 好喝 一股 味道 ,Love
真 好 出去玩 喽 最近 好 困惑 做 东西 懂 ,Sorrow
心想 终于 磨磨 唧唧 看 直想 快进 有病 ,Disgust
家里人 住院 心脏 搭桥 ,None
希望 时 心态 ,None
增加 开支 应该 大力发展 经济 目的 ,None
哈哈 安乐死 一向 温柔 ,Happiness
阳光 总在 风雨 好好 挖 会 收获 价格 亏待 淘金者 ,None
喜欢 刘嘉玲 杜鹃 衣服 ,Love
" ipadmini 竞争力 强 , 3g 版 七 儿子 kindle 价格 摆在  ",Disgust
还好 吃 东西 ,Sorrow
当时 正写 东西 激动 冲动 魔鬼 ,Sorrow
去年 去过 杭州 西湖 真的 超美 姐姐 机会 ～ ,Love
闹腾 头发 少 掉头发 厉害 ,Sorrow
药 留着 吃 女权主义 分子 天生 汉奸 女 汉奸 天生 女权 分子 — — 无例外 ,Disgust
哈哈哈 哈哈 逗 ,Happiness
哈哈 洒脱 期盼 2012.12 21 到来 ,Happiness
更是 阶层 除非 特别 厉害 本事 触碰 上层社会 提 前 500 公司 ,Sorrow
不行 太瘦 大门 200 斤 ,None
坐等 好消息 哈 ,Happiness
报告 老师 坏人 诱导 好好 社会主义 接班人 ,None
喜欢 单眼皮 李钟 硕丁 一宇 ,Love
解放 下学期 会 水深火热 ,Sorrow
王局 我要 做 颜粉 实在 太帅 ,Love
发图 以示 证明 说 事实 ,None
不到 一个月 找 小学 妹 反思 做 好 ,Sorrow
河南人 评论 很 痛心 河南人 素质 太 低 ,Disgust
盯 短小 金针菇 陷入 沉思 ,None
哈哈 好巧 00 喜欢 90 后大 姐姐 玩 ,Happiness
小秀 一把 哈哈 ,Happiness
哈哈 忙 感觉 ,Happiness
互动 榜前 五 月 礼物 ,None
啊啊啊 亲王 学校 干嘛 学校 顶 俞灏明 高校 教授 ,None
噢 说 很 好 嫁给 费玉清 ,None
梦想 人儿 ,None
太高 身边 多人 总有 偷偷 付出 ,None
成功 真狠 棒 ,Love
嘻哈得 日 完麦蒂来 学校 耍 ,None
几首 慢歌 截取 最 喜欢 ,None
那天 拍外景 临时 咖啡店 老板 拉去 拍 ,None
宽握 影响 效果 一段时间 ,None
事业 希望 ,Love
谢谢 熊猫 君 看球 决赛 菲律宾 ,Happiness
腊鸡 机会 腊八节 去一趟 安昌 古镇 感受 年 味儿 ,None
好 好吃 ,Love
快递 事情 说 不准 ,None
手 倒 ,None
朋友 粉丝 举报 ,None
24 小时 脾气 差 ,Disgust
热 保温 袋 ,None
男 享受 女 ,None
您老 先出 满满 爱 满满 写得 好些 睁眼 黑 ⊙ ▽ ⊙ ,Disgust
油价 太高 只能 少 加点 喽 ,None
恩 爱 随便 选个 岔路 很 好看 ,Love
说话 刻薄 生活 很 幸福 ,Disgust
" 唉 , 老 拽 拽 减肥 包子 脸 肋  ",Sorrow
哈哈哈 安慰 喜欢 ,Happiness
看 完 无所谓 ,None
挺 好 亲爱 皮皮 出门 上班 回家 看书 挺 规律 蛋卷 相亲相爱 陪伴 好好 生活 ,Love
此时此刻 说 宝宝 ,None
好滴 好 滴 ,Happiness
想 开心 嘻嘻 有人 开心 必然 有人 想 开心起来 ,Happiness
天 暖和 再 估计 嗨 冬天 玻璃 很 通明 ,None
无比 人偷 野 哦 上网 买过 咯 ,None
教练 休息 调整 练 一个月 变化 迎接 陈 教练 回归 ～ ,None
哈哈哈 哈哈 本来 想 看 挺哥 动作 不去 ,Happiness
怪 姗姗 正 姗姗 毁 演 角色 气质 装 可怜 ,Disgust
好 好 期待 哈哈 ,Happiness
谢谢 友 听从 建议 ,None
图 看 想 吐 妈 新剧 女主角 丑 ,Disgust
惊喜 医院 看望 二龙 湖浩哥 ,None
紫色 万圣节 ,None
植树 生 先 -- ,None
嫌弃 扑 ,None
很 难养 好 你养 活 ,None
买点 烫伤 药 ,None
肯定 压力 太大 考完 睡 两天 好 瞌睡 好 ～ ,Love
熊 孩子 爸妈 社会 一大 公害 ,Disgust
明哥 怎么回事 注意 保护 别 留下 毛病 多吃点 猪 筒 骨 ,Love
抖音 土味 我觉 快手 偶像 刘全 ,Happiness
问题 好 说 ,None
" 太好了 , 我爱你 , 真 充满 肥艺  ",Love
骂 ,Disgust
生日快乐 25 岁 花季 ,Love
娱乐 营销 号 写 国内 男星 长相 气质 写 杨洋 气 吐血 ,Disgust
有病 出口 成脏 国人 耻辱 好像 有意 搞 民族 分裂 狗 汉奸 说 ,Disgust
言不由衷 牢骚 ,Disgust
感受 最近 胖 露脸 ,None
谢谢 大哥 回复 教练 ,Happiness
听 说 看清楚 不用 p 真实 最美 女神 淤青 美美 哒 应该 消散 ,Love
你害 ,Disgust
交了 电视 费 宽带 费 长 眼睛 嘴巴 资格 说 爽姐 演技 烂 令 观众 窒息 荼毒 影视界 搞脏 演艺圈 ,Disgust
吵 干嘛 会 很 可笑 无聊 ,None
刚刚 打电话 嘿嘿 改天 再 约 哈 ,Happiness
三个 重量 先 做 一段时间 四个 重量 头 练 第二天 胳膊 抬 起来 ,None
很多 ,None
抓 妖记 真的 好看 不如 唐探 网上 水军 刷 ,Disgust
残暴 橙 哈哈哈哈 哈哈哈哈 剪刀 ,Happiness
期 衣服 外套 太贵 接受 买 ,None
听 muramasa 想 起来 听 ,None
说 ,None
白富 美 高白 胖 ,Love
耍 朋友 好 开学 事情 确实 比较 ,None
东北 还好 说 所有 河南人 打心 眼里 贼 ,Disgust
明天 丽江 哈哈 ,Happiness
放心 狗 喝 一整瓶 第二天 软便 无毒性 ,None
尊重 漫画 扎克 施耐德 一毛钱 关系 ,None
玩具店 排 很 长时间 亏 耐心 ,Love
书 很 全 分类 清楚 ,Love
训够 好好 有心 噢 ,None
很 有意思 年轻 时 阿娜 多姿 很 风韵 精致 女人 ,Love
健身房 好 少人 ,None
情愿 见 不到 不想 命 搭 ,None
男朋友 样子 ,None
表情 好 无辜 脚上 毛毛 感觉 穿 双 拖鞋 ,None
眼睛 两个 气死我了 ,Love
长胖 入冬 大吃大喝 长 斤 打算 完 春节 再少 吃 点 哈哈哈 ,Happiness
粉蒸肉 饭 听 起来 好 好吃 南门 ,Love
电眼 闪 瞎 ,None
本来 全民 牛牛 时代 app 正规 加价 昆明 反正 看好 做 ,None
哈哈 记得 当时 听 好多遍 妹纸 好 ,Happiness
仔细 看人 写 一大 段 详细 解释 眼睛 ,Disgust
好几个 高校 点映 影院 点映 ,None
宋 师兄 真的 爱 麻辣 幸福 ,Love
哈哈 注意 看 想着 步数 ,Happiness
工作人员 诶 懵 逼 ,Fear
哈哈 买件 厚 衣服 穿起 老妈 月 三亚 耍 热 热 ,Happiness
咬 错 ,Disgust
佳哥 说 直白 姐在 中行 信息 平台 佳姐 靓照 咯 ,None
" 好 ! 延合 两个 外国人 , 爸妈 我练 听力 ! 好白  ",None
过度 谦虚 骄傲自满 哦 提醒 哦 ! ,None
真心 粉 教主 挺累 ,Sorrow
回答 我试 两天 手臂 痘 印 淡化 ,None
哈哈 喜欢 左边 应该 左边 比较 好 眼光 比较 奇怪 ,Happiness
哈哈哈哈 哈哈哈哈 哈哈哈 咖啡厅 喜欢 钢琴 喜欢 安静 喜欢 ,Happiness
中国 导演 里 最好 很 商业 ,Love
永远 好好 穿鞋 ,None
昨天 ins 关注 一瞬间 粉 ,None
回来 衣服 全穿 身上 ,None
环境 差 十八九 结婚 大有人在 三十 老人家 坎 那种 三十 前 抓紧 ,None
真的 很 贱 欺骗 谎言 妈 渣 说 说不完 ,Disgust
比心心 说 起来 期待 做饭 教程 便当 超 好吃 ,Love
马马虎虎 行 业务 熟练 手忙脚乱 中 ,Sorrow
叛逆 期 少年 需要 青菜 好像 样子 ,None
想 哭 刚刚 腿抽筋 右腿 抽完 抽 左腿 ,None
想到 肮脏 夜晚 想到 自杀 ,Disgust
imax 版 效果 不错 ,Love
说 ,None
哈哈 冲动 回去 灌水 嘻嘻 ,Happiness
哒 家人 健康 开心 最 希望 父母 长命百岁 ,Love
学校 饭菜 怀念 起来 太好 ,Love
福塔福塔 看福塔 会 生病 感冒 发烧 ,None
好 男主 感觉 ： 张 娜拉 衬托 老 笑 深井 冰 get 不到 笑点 ,Disgust
几场 老 詹 掌控 全局 ～ ,Love
夸 我家 太阳 妈妈 很 好 ,Love
朋友 募集 做好事 公益 资金 需要 实名 验证 这是 信任 基本前提 ,None
虫子 拍 绿水 恶心 ,Disgust
哈哈哈 哈哈哈 哈哈哈 哈哈哈 为啥 看不起 ,Happiness
请 破坏 同学 之间 友谊 感情 无价 ,None
加拿大 华人 餐厅 更多 专坑 华人 自家人 不坑 自家人 能算 友军 ,Disgust
27 号斗放 老 ,None
肯定 会 找 蹭 饭 放心 ,Happiness
会 加油 哈 考完试 交完 论文 再见面 好好 聊聊 哈 ,Happiness
脸比 女生 很 过分 ,Disgust
帮 企业 支持 乙方 创业 显得 一点 意义 ,None
嘴 痣 需要 辨识 度 哈哈哈 哈哈 ,Happiness
心眼 这是 纵火 案件 失火 事件 ,Disgust
迟点 比赛 没事 迟早会 哈哈 ,Happiness
服 每次 想 写 一点 高深 东西 想到 查找 资料 算了 写 低能 那种 ,Sorrow
挑三拣四 真的 求 帮忙 可不是 ,Disgust
好看 皮囊 千篇一律 有趣 灵魂 万里 挑一 显然 村花 万里 挑一 ,Love
大学 二年级 大学 二年级 木兰 辞早 忘 干净 ,None
口水 掉下来 咯 你们好 过份 吃 吃 咯 发图 ,Disgust
帮 留 抓紧 ,None
希望 看一看 地坛 ,None
会 多多关照 ,None
翻 墙头 姐 最近 挺 喜欢 小白 ,Love
人去 ,None
一句 玩笑话 较真 ,None
阅读 理解能力 太 差 ,Disgust
阁下 贪官 搞 ,Disgust
季节 不油 提亮 效果 ,None
不用 神仙 水 我用 家 面霜 ,None
骂 骂乐视 反正 挺 牛 逼 ,Love
手动 难过 鬼 ,None
女朋友 好看 细胞 单位 ,Love
哥是 单身 你行 ,None
少女 心 爆炸 ,Love
时间 想来 太 喜欢 ,Love
真假 特姐 ,None
姓 g 有缘 ,None
好 放 ,None
有没有 时效性 说 ,Disgust
六点半 出发 玩 ,None
前段时间 只好 怪 几天 天象 不好 ,Sorrow
家 不吃 有人 吃 青蛙 野外 抓 那种 不好 解释 ,None
夸张 会 喜欢 第二个 第三个 人得 话 说明 非他不可 ,None
哈哈哈 哈哈哈 挺乐 互动 挺 爱 ,Happiness
想来 说 ,None
额 够 无聊 ,Disgust
跑 男里 最 喜欢 感觉 真的 陈赫 关系 舍友 ,None
不如 爱 疯 修图 舍近求远 ,None
h 哈哈 预祝 下次 撒 ,Happiness
说 歌曲 里 一声 mai ,None
良心 痛 说出 话 ,Disgust
同一首歌 唱 两次 节目组 估计 同意 放在 比赛 绝对 稳赢 唉 ,Sorrow
本来 好看 ,Love
哈哈哈哈 哈哈哈哈 男朋友 每次 捡 空头 浪死 喷 ,Happiness
摸摸 问题 ,Love
期待 后续 作品 ,Love
哈哈 是因为 维多利 广场 本来 打算 买书 ,Happiness
这位 朋友 请 摸 良心 说话 ,None
看不惯 会员 ,None
发现 双 ,None
本来 很 开心 看 爱 春天 每次 看 每次 头疼 有没有 俞灏明 当回事 ,Disgust
这是 教养 好 剪辑 东西 信 看过 视频 择 天记 莫雨 长生 配在一起 ,None
可爱 泪水 ,Love
哈哈哈 good 顾客 满意 好 ,Happiness
发泄 ,None
哈哈 口味 吃 买回来 想起 ,Happiness
真的 超 好吃 加油 看好 哦 ,Love
地方 出差 羡慕 ,Love
放 敢 约 ,None
孩子 再 嘴硬 ,None
请 吃饭 庆祝 ,None
勇敢 敢 念念不忘 ,Sorrow
屁墩 自恋 小姐姐 喜欢 ,None
萎靡 样子 ,None
转移 话题 忽略 说 第一句 话 ,Disgust
说 生 孩子 疼 假 ,Sorrow
同学 说川大 华西 排不上 全国 前列 ,None
爆爆 我家 七楼 吓死 ,Fear
哈哈 别去 直 吹 空调 就行 ,Happiness
看 眼镜 男子 萌得 死去活来 ,Love
努力 哦 师兄 好好 保养 努力 努力 努力 嘿嘿 表白 视频 天才 发 帮忙 转 ,Happiness
结局 一点 不好 ,Sorrow
肿 厉害 ,Love
好串 ,None
散步 保证 胖 慢跑 最好 再 不行 快 走 ,None
路 心疼 路 心疼 巴不得 他俩 百年好合 ,Disgust
感觉 好吃 ,None
理解 全职 主妇 神经质 哈哈 ,Happiness
callforsomebody = 支持 support （ 说成 打电话 很 尴尬 原意 支持 / 召集 ） ,Sorrow
告诉 红色 超级 美丽 ,Love
完 爱上 这家 书店 ,Love
" 很多 灵 没感 拍 惊喜 , 瞬间 凯旋门 拥挤 人群 中 恢复过来  ",Happiness
中 一项 愿望 ,None
折起来 折到 印标 说叠 好 地方 挂 ,None
每次 朋友 会 去一趟 ,None
哈哈 好 感谢 ,Love
无辜 额 写 很 好 ,None
梦想 ,Love
下次 再 护照 回来 办太 麻烦 ,None
真 好 太慢 杂志 里 文章 写 不错 ,Love
哈哈 讲佐 出黎 起码 感动 甘米 系有 诚意 咯 ,Happiness
适合 喜欢 会 遇见 喜欢 适合 ,Love
太 刺激 昨夜 冻死 今日 热炸 ,Sorrow
high 惨老涉 勒个 单怕 一周 恢复 转来 ,Disgust
宝宝 画 口红 ,None
想 看 恋爱 看 题材 嫖文 ,None
噶 便宜 酒店 订好 闹 ,None
想 换 地税 ,None
法律 危险 犯 一说 放火 罪 纵火罪 纵火罪 本来 危害 公共安全 法盲 丢人 ,Disgust
等于 考勤 全勤奖 取消 只不过 刷卡 刷 有人 干脆 上班 少 ,None
不来 请 喝酒 安慰 安慰 ,None
算 做 生活 所迫 饿死 ,None
哈哈哈哈 先 灌点 凉茶 再 吃 下次 饼干 好 ,Happiness
长帝 感觉 基础 温度 偏 高额 ,None
真滴 哈哈 青雪 老师 唱歌 ,Happiness
撩 行 ,None
字 真 好看 敢 差点儿 ,Love
直播 朋友 婚礼 哈哈哈 ,Happiness
感觉 ,None
哈哈 买 苹果 ,Happiness
哈哈 妹妹 一点点 ,Happiness
每次 遭受 冷暴力 想 该卷 钱 跑 路 ,Sorrow
北方 人高些 南方人 平均 身 高矮 ,None
怎么回事 没人 手机 壳秀上 l 吃 喜欢 摔 手机 ,None
加油 25 日子 本来 集齐 365 张 送出去 小伙伴 帮带 真是太 感谢 ,Love
演员 粉跑 作者 微 博里 撒野 第一回 拍 三本 本书 剧粉 戏多 不配 非 看书 说明 不自量力 ,Disgust
导师 会 连续 给我发 十多条 超过 50 秒 语音 还会 接 半个 小时 语音 ,None
小小 v 努力 发展 ～ ,None
一年 一年 再也 回 不到 从前 ,Sorrow
看不惯 咬 ,Disgust
哈哈哈 哈哈 微 商都 比毒 鸡汤 可爱 ,Happiness
梦里 会 见到 ,None
还好 编剧 脑洞 好 官方 吐槽 看得出来 超 用心 ,Love
哈哈 灏 明 心机 单纯 善良 肯定 太忙 ,Love
明天 寝室 收拾 东西 明天 晚上 走 回家 改 论文 咋办 走 早 有点儿 忐忑 ! ,Fear
迪丽 热巴 ,None
躲 当权者 裤裆 里 舔 屎 吃 很 安全 ,Disgust
爱 光光 光光 魔理沙 超 好看 ,Love
发 照片 说 拍 如花 照片 说 几天 ,None
～ 分不清楚 ～ ,None
评价 猪狗 ,Disgust
关键 骗人 伤 我心 ,Disgust
哦 哦 ,None
翻书 可怜 晴雯 看过 新版 想起 晴雯 脑子里 杨幂 ,None
看 主页 会 抢红包 ,None
包括 嘻嘻 说 抱歉 很久没 看过 注意 关注 事 ,Happiness
贤惠 儿媳妇 ,Love
说 嘴巴 贱 早晚 招 报应 ,Disgust
12 期 免息 券 几秒钟 ,Sorrow
无欲无求 一生 耻于 铜臭 静 洗心 无奈 世事 纷繁 乱 良人 总 坏人 欺 ,None
喜欢 ,None
童年 女神 喜欢 很多很多年 ,Love
我要 潜 第一个 先潜 ,None
# 俞灏明 七年 # 俞灏明 # 贪污 公家 百变 抓 起来 抓 起来 ,None
香 山脚下 卧佛寺 四合院 不错 推荐 ,Love
模式 好过 冷冰冰 书店 ,Love
游戏 好像 很 好玩 ,Love
恩恩 站 太早 不好 鱼儿 真棒 ,Love
路 金波 捧 不用 费功夫 辨别 ,None
小气 大方 很 ,Disgust
无,Love
如果说 资源 确实 前 几年 年 年 烂片 作 ,Sorrow
嗷 感觉 工作 太 平淡 好 无聊 ,Sorrow
原图 问题 印刷 锅 哈哈哈哈 买 茉莉 蜜茶 两人 白眼 ,Happiness
喜欢 行政 管理 事务 精力 兴趣 打理 搞 反而 干扰 事情 ,Sorrow
整天 说 找对象 ,None
40 支援 你点 买手机 ,None
玫瑰 意义 深重 花 好好 收着 ,None
看 很 久 哈哈 ,Happiness
说 抱 走 ,None
不见 受 啥子 刺激 咯 ,None
美死 淘宝 达 淘宝 牛 ,Love
活在 世界 里 ,None
亲 过些日子 找 我爸 生病 勤劳 帮 妈 干点活 ,None
世道 用钱 解决 事情 用钱 解决 ,None
schedule 好 开张 说 尝尝鲜 ,None
哈点 先算 诚意 ,None
马 总 真 好点 赞小 能手 ,Love
价格 贬到 50 元 依然 爱 幸运 见证 ,Happiness
好像 春雨 面膜 纸 大脸 ,Love
理解 很少 ,None
佩服 真的 吃 ,None
高新 青柠 公寓 订 ,None
小偷 多得很 ,Disgust
好 六七 吖 ` 慢慢 看 ,Happiness
颜值 摆在 不美 夏至 未至 楚雨 荨 x 顾海 视频 预热 ,Love
中国 会 机会 ,None
哈哈哈 应该 有个 聪明伶俐 女主 ,Happiness
好 我姐 陪 逛街 试试 下班 随便 看 两眼 ,None
好 专一 哦 ,Love
没教养 熊 孩子 ,Disgust
楼下 评论 女士 骂 给我发 私信 骂 得罪 ,Disgust
奶泡 狼狗 那种 毯 几是 小奶 狗 ,None
这有 辞 辞 饿死 ,None
我会 努力 ,Love
先说 说 东东 ,None
这人 打出 全名 ,None
鱼与熊掌 兼得 懂 同类 东西 两块 拼图 拼成 完整 圆 ,None
厉害 酒量 差 老 欺负 ,None
感觉 开口 说 ： 在座 腊鸡 ,None
加油 努力 ing ,Love
大爆 必然 合作 ,None
好 现象 很少 剪 视频 人点 赞 ,Love
甘派 街坊 时 记住 派部 花晒 系 隔离 邻舍 ,None
热恋 中 女人 吖 ,None
三十 28 离开 家 ,None
糊到 不行 甜蜜 负担 ,Love
客户经理 真 好 套近乎 ,Love
超 厉害 绣 无从 下针 ,Love
软乎乎 很 能量 情绪 很 崩掉 ,None
哈哈哈 还好 mac 单色 专柜 单色 里算 便宜 ,Love
身上 痛不痛 ,None
时间 倒 快 明晚 凌晨 00 ： 00 ,None
会 巡演 大部分 唱 这张 专辑 歌 ,None
真的 经验 经验 工资 高 ,None
世界 最远 距离 看好 声音 看 快 男 ,None
谢谢 善良 美言 事 企鹅 很 开心 ,Happiness
实习 找 工作 研能 回家 出去玩 一圈 考不上 投入 找 工作 大军 ,None
没见 大海 ,Sorrow
脸烂 卖 化妆品 护肤品 可怕 ,Disgust
应该 宝贝 好 想 吃 烤 冷面 ,Love
颜末 女二 友情 出演 23 集 ,None
喜欢 ,None
消极 ,None
大神 讲 清楚 耐心 哈 ,Love
post 君 女 汉子 低龄化 标志 ,None
敢不敢 再 懒 一点 ,Disgust
需要 加大 运动量 亲爱 ,None
小孩 剪头发 高级 服务 哭闹 好 说 哈哈哈 哈哈 ,Happiness
把门 开着 不行 ,None
说 回来 说 请 吃饭 黄鼠狼 鸡 拜年 ,Disgust
擦肩而过 大田 哈哈 暑假 暑假 期待 暑假 好 好玩 ,Happiness
放弃 ,Love
看 完 泪 奔 几次 泪腺 发达 ,Sorrow
说 小女生 好 ,None
现场 助理 网电 前台 干 大杂烩 ,None
嘿 水果 套餐 很多 办公室 白领 喜欢 ,None
哦 想 爱 想见 段子 手 ,None
50 通话 半年 免费 升级 长期 短信 所有 联通 号码 送 ,None
太 可怜 你老 两个 ,None
有颜 反正 很 好看 ,Love
忍辱负重 好好 奋斗 卧薪尝胆 考试 顺利 ,Love
哈哈哈哈 哈哈哈 第四季 回归 超 开心 ,Happiness
预感 会 夸菜 锦上添花 ,None
请问 私自 删除 差评 怎么回事 ,None
太 狠毒 ,Disgust
好 幸福 国内 舞台 很 ,Love
哈哈哈 哈哈 两格 红色 会 显眼 肿 ,Happiness
那能 麻烦 格 喵 推荐 ,None
猪肉 脯 确实 很 好吃 ,Love
资道 喜欢 吃 天 吃 粉蒸肉 饭 ,Love
饼干 牛奶 蛋糕 笑 死 ,Happiness
老板 问题 ,Disgust
很 开心 开学 钱 ,None
希望 插 翅膀 朝阳 一飞冲天 ,Love
" 恩 , 去掉 淘宝 地址 自动 保存 选项  ",None
fresh 玫瑰 面膜 好多钱 我长 草 很 久 找到 合适 地方 买 ,None
工科 生中 能力 做 20 年 研究 不到 10% 剩下 90% 五年 内用 面临 淘汰 转行 ,Disgust
副 白色 不错 喜欢 米 米拉 ,Love
洗 头 吹风 吹 ,None
低 好几 届 ,None
只放 20 + 一点点 天 加 起来 28 天咯 ,None
没人敢 评论 哈哈 ,Happiness
田馥 甄 女人 耐得 住 寂寞 还好 小分队 小天 先 安抚 ,None
文理 不通 挂 科生 ,Disgust
感觉 昨天 rng 好看 ,Love
职业 ,Sorrow
您好 团长 私信 您 麻烦 您 查收 ,None
谢谢 师妹 欣赏 ,Happiness
暑假 快乐 ,Love
瞎 问题 ,Disgust
酸奶 太酸 忤逆 牛奶 哼 ,None
3d 看 看 3d ,None
额 ,None
牛 状态 再 好 碰到 扫把 星 状态 全 ,Disgust
明白 当时 状况 应付 领导 检查 摆样子 显得 荒唐 ,Disgust
泰国 天山 ,None
这部 剧唐晶 角色 形象 最 立体 符合实际 袁泉 很 气质 ,Love
恋爱 傻子 不想 去认 女孩 信任 ,Sorrow
～ 谢谢 葛菲姐 加油 多人 支持 会越 写 越 好 ,Love
换位 思考 肯定 情绪 起伏 ,None
故意 找茬 抄袭 承认错误 关 潘玮柏 事 ,Disgust
大老远 湖北 扛来 信封 白 瞎 再 扛 回去 ,None
世人 以貌取人 uknow ,None
腥味 死 虾 ,None
好 冷 东西 手里 变样 ,None
草 ,Sorrow
拒绝 吃 ,None
我妈 工作 家里 妈 阵营 爸 尴尬 ,None
还行 吃 好 ,None
嘻嘻 棒极了 ～ 墙上 开关 p p 掉 拼图 里边 卫生纸 ,Love
听 首歌 单曲 循环 晚上 感觉 很耐 听 ,Love
谢谢 旺妮 w ,Happiness
喜欢 挖出来 吃爽 ,Love
哈哈哈哈 哈哈哈 哈哈哈 哈哈哈 菜 主席 很 不错 ,Happiness
眼镜蛇 眼镜 发明 敢 示人 一条 好 蛇 小牛 挤 喝奶 ,None
前 几天 在家 空调 开着 闷 不行 ,Sorrow
没事 白 ,None
话 说 一辈子 找到 旅伴 很 会 ,None
友谊 阳光城 楼 cs 对面 ,None
上火 嘴角 消火 哈哈 ,Happiness
欢迎 归来 这脚 好丑 甘肃 有没有 花海 ,Disgust
天呐 楼主 帐号 异常 好 恐怖 ,Fear
公益 事业 ,None
灏 明不帅 帅 ,Love
截屏 转身 瞬间 笑 发火 ,Disgust
可怜 最 好看 贞子 from 午夜凶铃 不服 来辩 ,Love
喊 巨嘿 茄 ,None
泥潭 明明 rb 抓 好 说 ,Disgust
小心 穿 s 码 ,None
看过 真人 手 长 很 好看 自黑 ,Love
天 正当 最热时 吹 空调 却 回 宿舍 ,None
太坏 太坏 坏 奇葩 哈哈 ,Disgust
别 焦虑 心情 影响 孩子 ,Fear
那种 酷酷 ,None
38 站 没到 ,None
哈哈哈 我会 拔刀相助 ,Happiness
哥哥 我会 说 ,None
认出 黑漆漆 ,None
最近 爱惨 表盘 超好 搭 衣服 ,Love
开心 事 ,None
此书 相当于 圣经 相当于 发现 新大陆 ,Love
六一 西塘 兴趣 约 ,None
恩恩 支持 ,Love
挂 起来 放好点 放在 床单 晚上 睡觉 压一压 ,None
人多 嗨 氏 粉丝 服 楚河 证据 骂 证据 骂 搞不懂 嗨 氏 黑粉 ,Disgust
13 走 撸 满血 复活 ,None
范儿 不错 中性 感觉 中岛 美嘉 ,Love
不说 奔跑 节目 中鹿晗 热巴 态度 会 yy 这么久 ,None
啪啪 截图 可惜 保留 原版 ,Sorrow
看 骂 放心 话 好好 说 活该 喷 蜜汁 优越感 ,Disgust
快乐 快乐 最近 好不好 ,Happiness
皱纹 疼 ,Sorrow
背后 晓得 圈内 事儿 老 吴 最近 上升期 事儿 一出 难免会 影响 ,None
g7 那层 恶心 东西 ,Disgust
爷爷 参加 抗美援朝 ,None
昨天 拢 头发 ,None
啧啧 战绩 超越 某苏 喽 ,Disgust
protools 录音棚 编配 编曲 阿信 编曲 ,None
书 班里 零花钱 最多 人才 买得起 特别 羡慕 ,Love
有没有 皮肤病 医院 测 过敏源 测 注意 应该 好了吧 ,None
啥时候 好 ,None
学霸班 恐怖 陈 雨露 班 天天 看 电影 ,None
超 好吃 吃 泰国 浮云 ,Love
d5 自恋 讲 事实 ,None
上班 哈哈 考 事业单位 咋样 ,Happiness
需要 原谅 ,Disgust
应该 说 扎 试试 ,None
这倒 还好 舒服 ,None
有时候 真心 语 ,Disgust
早就 考试 周 哈哈 ,Happiness
哈哈 最后 一句 重点 见 家长 一切都是 ,Happiness
期待 说 说 三次 沙滩 裙 鞋子 防晒霜 买好 兑现 开车 两个 小时 ,Sorrow
我用 感觉 脸上 很腻 同事 感觉 ,Disgust
酒店 不靠 谱 ,Disgust
男朋友 气炸 赶紧 睡觉 梦里 梦见 明星 前天 晚上 梦见 林 更新 亲亲 哈哈哈哈 ,Happiness
前两天 好 透 咳 很 厉害 ,Sorrow
小妹子 嘴 甜 长得 很 好看 ,Love
想 起来 恶心 绝对 再 云南 ,Disgust
一套 最少 200 需要 1000 亿 资金 ,None
哈哈哈 哈哈哈 喜欢 少女时代 tiffany 妹子 莫名其妙 扣 喜欢 绿绿的 tiffany 显摆 拜金 认 哈哈哈 哈哈 懂 ,Disgust
超 美的 智 ,Love
小猪 约 当地 向导 国会 多一些 没删 ,None
恩 对滴 过年 回来 好好 陪陪 奶奶 ,Love
真的 真的 角色 演活 会 感同身受 ,Love
最 善良 ,Love
姑娘 路灯 亮 地方 走 ” 晚上 骑 自行车 巡逻 大叔 说 ,None
美图秀 秀 里边 拼图 功能 ,None
羡慕 不用 上班 带娃 玩 麻麻 ,None
貌似 笑笑 直播 脏话 ,Disgust
喜欢 感觉 ,Love
沉迷 赌博 沉迷 酒鬼 债鬼 个样 ～ ,Disgust
哈哈哈 没人 看吧 ,Disgust
六一 开心 点 ,Love
十个 高地 个基 （ 外加 名字 确认 基 ,None
说 ,None
抄 东西 不知羞耻 oppo b 样 ,Disgust
说 朋友 当时 留学生 身份 申请 白卡生 小朋友 毛 ca 华人 ,None
# 俞灏明 # 很 可爱 哦 天气 热 注意 防暑 ,Love
好 哈哈哈哈 双胞胎 ,Happiness
身高 站 好 和谐 ,Love
旁边 南京 ,None
唐诗 吉来 玩 ,None
指甲 修 好 神奇 ,Love
李宝英 结婚 影响 这部 剧前 七集 好看 ,Disgust
叮过 嘴 ,None
治本 花 点 时间 值得 嗒 ,None
郭 老师 草莓 味 哒 晚安 ,None
" 看 画面 很 可爱 ` ,  ",Love
好奇 自取灭亡 ,None
wow 好 喜欢 ,Love
哈哈 歌词 ,Happiness
家 宝贝 真 好 还会 碰 ,Love
薛 老师 ” 爱 风流 ” 好 赶潮流 喔 ,Love
好人 ,Love
平时 衣服 很 难看 ,None
会 慢慢 找 说不定 有人 暗恋着 哈哈 ,Happiness
挨揍 不远 可不 求情 好自为之 ,None
说 gay 狗 ,Disgust
连夜 出发 老 司机 ,None
怀念 宋立鑫 说来 北京 买 两个 烤 苕 皮 莫名 重庆 东西 好吃 ,Love
支付宝 信用卡 储蓄卡 不大用 ,None
真的 优惠 ,None
托举 猫猫 推广 ,None
不错 总归 王爷府 撒 ,Love
迎春 迎春 终于 迎来 春天 ,None
打电话 ” 真的 很 尴尬 ,Sorrow
哈哈哈哈 哈哈哈 很 好 ,Happiness
脾气 不好 脾气 不好 讲话 冲 我认 没干过 事 背锅 ,Disgust
budget 不高 50 接受 ,None
自动 回复 ,None
昨天 想 好 吃 ,None
图 很 应景 产 哈哈哈 ,Happiness
呦 翻出来 听 哈哈 ,Happiness
瘦 成熟 妩媚 ,Love
只想 说 走 好 累 ,Sorrow
真心 感谢您 播讲 追 很 久 ,Happiness
1060 高配 顶配 配置 初始 中等 画质 不到 外星人 外星人 出了名 性价比 低同配 高价 商务 ,None
扭 脚 抽筋 怎么回事 唉 ,Sorrow
买台 不错 ,None
