Text,label
吵死 盛情 邀请 你好 几次 厦门 拒绝 无发 说 ,Disgust
蚌埠 周 春雨 调 省里 副省长 ,None
求祛痘 方法 （ 一百年 长 痘 手足无措 哈哈哈哈 哈哈哈 哈哈哈 ,Happiness
做 本事 海南 玩 记得 吃 清补凉 ,None
会 烧屏 一年 ,None
确实 实至名归 好 好 这时候 发挥 民族 自尊心 真的 自卑 ,Disgust
杰伦 好像 节奏 ,None
三个 放 会 化学反应 ,None
我租 好 房子 装饰 啥时候 ,None
想 任性 可惜 钱 ,Sorrow
快 不行 快 雨季 下雨 彻底 菜 ,None
modern 感觉 太作 同性恋 个人感觉 倒 挺 喜欢 pill 一家 ,None
老 褶子 裁判 八字 不合 ,Disgust
枇杷 满枝 吾 妹未出 阁楼 时 所刻 糟蹋 完矣 ,Disgust
nozuonodie 换 好 ,None
小王 成 奴才 皇上 忘 十七 爷 味道 寻常 方子 做出 ,None
没事 讲 起来 很 好听 ,Love
哈哈 好多 事情 做 超预算 整个 感觉 喘不上 气 感觉 ,Happiness
合肥 站务 同学 说 丢 广铁 ,None
室内 放 室外 露台 快点 温差 再 多点 太阳 应该 几天 红 ,None
傻子 讲话 真的 累 妈妈 做 运动 好 ,Disgust
傻 ,Sorrow
女 穿 子弹 好看 换 店里 子弹 男 穿 好看 ,None
真无语 热门 学校 水军 ,Disgust
夸 ,None
美女 感觉 男生 无感 ,None
称号 没人 搜 闲着没事 搜 乒坛 王者 ,None
葡萄 员入 左来 令 反胃 ,None
说明 开发 ,None
想 引起 苹果 注意 苹果公司 他争 起来 目的 可惜 苹果 无视 ,None
讨厌 问题 ,Disgust
最近 看 小说 听说 凤凰 回来 ,None
好 谢谢 刚大 期 买台 电脑 寝室 太 无聊 ,Happiness
天 仁和 体检 六千多 港币 服务 挺 好 ,Love
王局 观念 准则 王局 说 丢 孩子 概率 不生 王局 说 产妇 自杀 概率 预防 追究 医院 ,Disgust
真性情 明星 太少 ,Disgust
" 不爱 vintage , 衣领 妥帖 裙摆 褶皱 （ mark 看 ）  ",Love
超 好看 小姐姐 越来越 会 凹 造型 ,Love
最 糟糕 莫过于 生病 想 身边 ,Sorrow
这歌 挺 符合 发挥 好 ,None
下次 请吃 东西 走 ,None
man 护航 编队 赛特 锋 快速 战斗支援 队 南宁 瞬间 土豪 欧洲 香港 考察 回来 农奴 翻身 当家做主 ,None
很 喜欢 很多 笑容 很多 快乐 ,Love
胜利 怼 回 ,None
暑假 好 回去 ,Happiness
哈哈 宝哥 纷纷 八错 八错 ,Happiness
重点 缺钱 ～ 追求 ～ ,None
本来 想 剪掉 相机 效果 好 ～ ～ 毛毛 ,Love
哈哈哈 好 好 ,Happiness
弄 垫子 咬 稀巴烂 ,None
喜欢 肉 嘟嘟 耐看 ,Love
姑娘 长得 真 好看 ～ 拍 真 好 ～ 哈哈 ,Happiness
一层 忽然 抓住 救命草 ,None
天天 吃 哈哈 ,Happiness
放心 我会 很 开心 不用 担心 好好 经营 感情 好久没 想 ,Love
老毛病 最近 天 冷 疼去 检查 复位 没事 ,None
仔仔 越来越 大食 老 母亲 加油 ,None
看过 哈林 篮球 环球旅行 家队 华盛顿 军队 爷爷 ,None
一分钱 够买 肉 吃 ,None
既来之 则安之 接受 改变 训练 狂魔 霸道 ,None
这么晚 老板 洗衣服 郁闷 心情 平复 点 ,Sorrow
总共 多久 七月 中 回来 递 一个月 比较 担心 ,Fear
不许 诅咒 我木 有钱 路口 搞 解决不了 拥堵 问题 ,Disgust
蛮 无聊 ,None
闪婚 说 会 很快 结婚 意味着 会 低调 结婚 会 很 高调 闪婚 ,None
善良 美丽 女孩 ,Love
终于 懂 赞 ,Love
结婚 干嘛 看 玩 好开心 ,Love
心疼 刚刚 专辑 多人 怼 ,Sorrow
哦哦哦 好 好 谢谢 亮亮 ,Love
灶王爷 与时俱进 搞 新潮 估计 西装革履 ,None
他肯 买单 车 好 咯 ,None
看 电影 冷 天 ,None
坨 坨 好 可爱 哈哈哈哈 哈哈哈 ,Happiness
好看 美美 健康 ,Love
预期 目标 做 事 缘由 哪管 真假 ,Disgust
希望 下回 帅 店员 ,Love
到时候 望尧哥 手下留情 轻虐 ,None
看不到 写得 火车 wifi 特别 不好 打不开 文字 真晕 这条 发 很多遍 发不出 ,Sorrow
不想 好好 安利 剧 ,None
朋友 月生 月 照到 先天性 心脏病 出世 入 icu 本来 定点 市二 但市 二 信心 做手术 后来 转左去 省医 ,Sorrow
晚上 照镜子 好 仔细 看吧 ,None
气死 ,Disgust
嘻嘻 凡 风顺 ,Happiness
下次 可口 ,None
放假 不好 ,None
应该 解决 看 v 百度 链接 猜测 设置 原因 ,None
推荐 真的 不错 诶 ,Love
楼下 说好 美 没看 拍 ,Love
长 没过 情人节 眼下 圣棍节 ,None
赢 赢 最近 输 从没 赢过 ,Sorrow
男女 主是 原声 ～ 配角 好多 台湾 演员 配音 很 别扭 高以翔 声音 超级 适合 演 华裔 哈哈 ,Happiness
您好 您 屏幕 边缘 屏幕 快速 滑动 观察 滑 ,None
中国 学校 关系 节奏 好不好 仅仅只是 吐槽 人民 教师 个人行为 学校 瓜葛 ,None
说 活该 猜 做 母亲 ,Disgust
看 完 ,None
太 好看 ,Love
哈哈 ～ 自知之明 ～ 信 ,Happiness
看 眼袋 几鬼重 礼拜 忙 死克 ,Sorrow
本来 说 感觉 很 不好 越笑越 温柔 ,Sorrow
演出 前 好 鸡翅膀 水果 请 可乐 ,None
带上 这条 单身 ,None
两张 图 p 看着 不像 ,None
别闹 老弟 这说 假话 会 遭 雷劈 ,Disgust
黑 ,None
早上 删 客户端 未 登录 状态 弹 出新 消息 提示 激动 坏 登 登上 ,None
云南 省外 读书 ,None
不当 妃子 天天 爬墙 调皮 妹妹 黑底 ,None
二老 说 王凯 估计 说 知青 齐勇 肯定 记得 当年 追剧 ,None
明明 傻乎乎 女子 高中生 【 好 】 可爱 【 哭 起来 】 ,Love
武藏 很 好看 ,Love
哈哈 ,Happiness
买 吃 报应 ,None
下次 绝不 手软 ,Disgust
哈哈 我会 娶 三只 母 恐龙 会 太多 ,Happiness
哈哈 慢慢 读 好 想 学法语 哦 说起 好听 忙季 完 学学 嘿嘿 ,Happiness
哈哈 摩 羯 男 很 优秀 ,Love
别整 高雅 好 俗人 ,None
爆发 闲在 中单 不用 前期 常单 杀 后期 不行 除非 队友 给力 ,None
吃醋 姑娘 ,None
问题 效果 ,None
还好 咯 体重 100 斤 100 斤 难 ,None
感觉 天气 好好 特别 暖和 你家 狗 眼睛 很大 哈哈哈 ,Love
应该 追逐 ,None
哈哈哈哈 开玩笑 谦虚 ,Happiness
噢 感谢您 抬爱 请 批评 提意见 建议 噢 ,Happiness
认同 卸载 手机 qq ,None
说错 理解 错 视频 里 第二个 ,None
说 咖啡 有毒 自干 公关 星巴克 解释 信誓旦旦 地说 抛开 剂量 谈 毒性 耍流氓 ,Disgust
好 见 讲讲 多难 ,None
说 好 心动 ,Love
有点累 日本 确实 值得 往返 ,None
放手 你好 再 执着 ,None
哈哈 分手 割腕 那种 ,Happiness
好好 爱 ,Love
单纯 美好 ,None
哈哈 我养 那盆 仙人掌 黄 放出去 ,Happiness
评论 太渣 差评 掂量掂量 说话 谱 ,Disgust
爱 阿清 女神 女神 女神 ,Love
前辈 大佬 好好 修炼 多多关照 ,Love
哈哈哈 好 在彤姐 督促 行 ,Happiness
先 瞎说 怪不得 骂 不粉 俞 评论 转粉 真的 low 不行 ,Disgust
说 放 ,None
谢谢 液体 超过 100ml 担心 托运 麻烦 ,None
客气 私信 ,Happiness
呜呜 吃 没用 ,Sorrow
听不懂 说 ,None
头 两张 真 好看 ,Love
生日 同乐 同乐 ,Love
反馈 收到 方言 识别 效果 会 努力 优化 哈 ,Love
好快 忽然 伤感 ,Sorrow
lia 说 这句 话 ,None
打呼噜 最 闹心 忒 揪心 听 声音 背 过气去 ,None
好好 珍惜 异乡 时光 ,None
很 喜欢 地方 ,Disgust
否极泰来 触底 反弹 ,None
说明 爱 深切 ,Love
心里 理智 回头 分开 明白 ,None
几天 我要 洗 几张 照片 放 床头 哈哈 ,Happiness
新乘 老实 本分 ,None
吃 身体 好 功效 ,None
嘻嘻 牛 哈 ～ ,Happiness
霓虹 真的 太 吃 便利店 好吃 ,Love
多年 听 周杰伦 再也 超越 节奏 起来 唰 唰 唰 翻出来 很多 记忆 ,None
哈 期待 死 ,Love
值得 你别 重 ,Disgust
直视 土土 ,None
多年 未娶 孩子 ,None
友情 提示 七八 月份 最 好玩 不介意 多来 几次 ,Love
太逗 吃 搞笑 长大 哈哈哈 ,Happiness
适合 泥人 ,None
ohoh 依家 系 买回来 搽 ,None
降价 太 快乐 5000 买 2500 ,Disgust
真 爱 减肥 兜 茁壮成长 感觉 ,None
明天 连续 四天 星期一 电话 ,None
注意安全 美女 真心 需要 保镖 ,Fear
唉 ～ 系甘 ～ 宜家 咩 问题 ,None
眼光 哈哈 确实 很 美味 ,Happiness
没来 报信 ,None
打算 兼职 做 贴膜 ,None
谢谢 请 链接 年 买 组合 选 ,Happiness
波点 爱 老师 做 送 ,Love
好奇 寄给 ,None
干 哈哈哈 哈哈哈 ,Happiness
哈哈哈 嘻哈小 天才 想 很 久 记得 讲 哈哈哈 哈哈 ,Happiness
回复 发现 关注 悲 催 见谅 看 ,None
喔 喜欢 ,None
是从 早 八点 晚 九点 第七天 ,Sorrow
脑 残粉 体现 淋漓尽致 ,Disgust
太 好看 ,Love
很 哈哈哈哈 ,Happiness
单身 女性 吃火锅 男士 吃火锅 好点 尴尬 ,None
双玉嘛 双 y 喽 ～ ,None
考验 抵住 美食 诱惑 心 越来越 瘦 ,None
安东 对婉冲 讲清楚 ,None
值得 学习 ,None
扫 二维码 ,None
土豪 ,Sorrow
丫找 不到 狮子 电话 ,None
谱 谱 儿子 小太多 ～ 着手 ,Happiness
找到 走 关门 ,Sorrow
肉眼 可见 应该 应该 不要紧 网上 再 找 找 药水 ,None
唉 估 铁证如山 情况 真的 科学 ,Disgust
正逢 小雨 意境 ,Love
金开 chic 声音 征服 ,Love
哈哈 暑假 ,Happiness
闲 焦虑 忙 心急 说 工作 中 极其重要 心态 ,None
喜欢 烤肉 朋友 喜欢 韩料 每次 次 火锅 ,None
明白 干 缺德事 香橙 早年 疯狂 · · · · ,None
吸引 ,None
哈哈 配置 不错 ～ 赶紧 音乐 ～ ,Happiness
会 好 ,Love
你家 主人 吃 屎 说 咬 ,Disgust
睡 前别 总是 吃 东西 会得 胃 食管 反流 病病 ,None
说 拍 水平 看 少女 心 满满的 酥 不行 ,Love
哈哈 笑 死 明 ,Happiness
效果 不错 明明 药监局 列入 黑名单 东西 特殊 用途 化妆品 ,Disgust
快 看 我家 小猫猫 出生 ,None
陌陌 520 ,None
好吃 隆重 回归 土称 山樱嘛 好东东 ,Love
豁达 顿时 放心 ,Love
朋友 你好 美图秀 秀本秀 ,None
表现 外人 在外 人模狗样 在家 禽兽不如 帮 ,Disgust
东西 大大提高 生活 质量 用到 ,Love
电影 看 懂 一讲 似懂非懂 ,None
难答 古老 ,None
小辫子 ～ 爱意 ,Love
恩 ～ ～ 这首 喜欢 写 曲子 比收 歌要 好 最后 不怕 糊涂 挺 好听 ,Love
键盘 侠 只会 发泄 情绪 不堪 发泄 虚拟 网络 世界 ,Disgust
聆听 中 请 安静 ,Disgust
粉丝 这张 好看 ,None
承认 咁 小凤家姐 好 自恋 ,None
学校 偷过 手机 ,None
说 说 自爱 自爱 哈哈 ,Happiness
可惜 没想到 女主 最后 结婚 ,Sorrow
身材 太好 性感 胸肌 ,Love
买 衣服 穿着 暖和 ,None
唯一 答案 爱 人好 难 ,Sorrow
怎么着 明天 约场 球 释放 上鹏哥 ,None
紫苏 水 适合 长痘痘 不长 痘 ,None
后天 返校 作业 写 完 哭泣 ,Sorrow
理解 精神 高 能力 人情 关怀 意义 聪明伶俐 ,None
也许 一生 真的 长 多去 尝试 新鲜 事物 应该 ,None
明明 天天 吃 好 ,None
淫物 大人 ,None
钱谈 独立 人格 谈 关爱 ,None
我勒个 苍天 极好 ,Happiness
转发 菅田 山田 那条 推 ,None
爱 哒 ,Love
装 清高 受不了 圣母 跑 家乡 说 忍 ,Disgust
哈哈哈哈 很 激动 我要 点 宵夜 吃 ,Happiness
说 说 没用 ,None
恩恩恩 搜到 分 日霜 晚霜 哒 冬天 试试看 哈哈 ,Happiness
迟到 新年快乐 + 生日快乐 话 说 月 生日 太 厉害 ,Love
安心 按原 计划 发 找 ,Love
说 身体 作死 明白 ,Disgust
出口 成脏 最 恶心 ,Disgust
看 忍 多久 ,None
要来 问 机会 上班 活跃 ,None
可爱 很多 这位 真的 爱 真的 够 反正 不缺 读者 ,Disgust
不好意思 噻 表述 一种 以偏概全 赶脚 ,Disgust
训练 蹲 肩膀 ,None
哈哈哈 太 黑 一黑 成千 丑 ,Happiness
哈哈哈 肯定 喜欢 蛇果 ,Happiness
至少 昨天 安排 休息 上班 累 ,Sorrow
写 产品 日本 明治 技术 指导 生产 ,None
看过 北平 无战事 喜欢 有钱 聪明 喜欢 ,Love
有没有 西安 路边 油炸 菜 加炸饼 照片 北京 ,None
哈哈 真的 真的 美图秀 秀修 图 ,Happiness
全英文 真牛 逼 这年头 想 读研 是我太 上进心 没想 读书 ,Sorrow
喔 喔 计费 太 机智 ,None
论坛 说 bug 岭南 通 深圳 通是 反 默认 深圳 通 岭南 通 ,None
刚直 不弯 这件 事是 不用 怀疑 喜欢 看 美少女 心 ,Love
电 行 ,None
哦 可惜 电信号 ,Sorrow
还好 太古 里 gucci lv 逛 吃个 六元 蛋 烘 糕 走 ,None
实验 中医 几千年 人来 做 实验 方才 流传 ,Disgust
朋友 跳到 500 外挂 随便 帮 玩 200 ,None
抵挡不住 诱惑 偶对 甜品 向来 免疫力 滴 ,None
哈哈 钟爱 史 塔克 放在 第一个 ,Love
学生 党 钱 华为 旗舰机 买 便宜 荣耀 旗舰 ,None
喜欢 榛果 铁 喜欢 红 杯杯 ,Love
打折 返 确实 不错 ,Love
无神论 罗兴亚人 ,None
生快 哦 想要 连云港 敢 回来 ,None
好像 说 不收 工资 选择 职业 拿枪 指着 干 ,None
哇哇 谢谢 谢谢 随手 记录 美好 瞬间 ,Love
困在 南京 qq 微信 不好 使 ,None
龟壳 盖 ,None
多年 会 发现 高考 一段 经历 ,None
睡不着 偶然 女生 打上 星耀 不错 钻石 室友 王者 赛季 卡星耀 二 加油 ,Love
喜欢 歌里 世界 最自 ,Love
说 接济 家里 90 说 ,None
东北 人才 看 春晚 ,None
第一 感觉 屋子 好 漂亮 好 独特 再 想到 它会 若干年 强拆 · · · ,Love
美美 美 ,Love
政府 同意 人民 反对 请问 这是 政府 国家 哪部 法律 第几条 ,Disgust
球赛 姐姐 老 早就 看 识别 参数 改改 ,None
医生 静养 症状 再 慢慢 恢复 运动 真的 急 急死了 本来 练 成效 ,Sorrow
恶梦 ,Fear
珍惜 ,None
趁热 吃 凉 不行 ,None
好 烦躁 看 完 电影 烦 发泄 ,Disgust
火星 好像 不错 喜欢 类型 喜欢 青春 题材 晚上 自习 考试 ,None
太多人 忽视 说 傻 ,None
洋人街 朝天门码头 早去早回 会 下雨 ,None
真的 感觉 生气 心里 委屈 感觉 没事 ,Sorrow
边边 鹏 爷儿 可别 瞎 凑热闹 哈 ,None
快 看 赛车 总动员 张艺兴 配音 ,None
哦 说 隐隐约约 记得 狮子座 记错 哈 ,Happiness
女伴 鞠 ,None
反正 脸 肉 ,Disgust
问 颜色 不用 脱色 脱色 会 脱会 ,None
根葱 接触 ,Disgust
产检时 健康 ,None
妈 女 好看 跳舞 应该 ,None
看 脸 僵 华谊 帮 洗白 没少花 功夫 ,Disgust
山 感觉 好 爬 ,None
行 挺鲜 口感 ,Love
多谢 海兰 居多 一点 看着 文就 越来越 应该 ,Love
不行 孤儿 家人 ,Disgust
浪哥 走 路线 真 迷人 ,Love
最 讨厌 恶意 词 评估 恶意 香港股市 创 历史 新高 a 股 ,Disgust
骂 道歉 机会 乱 很 丢人 ,Sorrow
东西 偷 报警 没偷 东西 报警 ,Disgust
看 追 这部 spy ,None
爱 女人 很 特别 金粉 世家 ,None
早上 睡觉 下午 晚上 溜达 日子 过得 浪费 ,Sorrow
折 耳根 超 好吃 云南 凉拌 放 哈哈 ,Happiness
喜欢 ,Sorrow
笑 死 好 想 转 新伟 那段 评价 真的 人生 最 准确 描述 ,Happiness
吃 开心 好 奢侈 ,Happiness
有钱 有权 很爽 ,Love
评论 太 工作 忙 一一 回复 友友 请 原谅 ,None
黑成 站 薛之谦 不爽 ,Disgust
说 任盈盈 三 想不通 ,None
哈哈 很 好 逛街 ,Happiness
朋友 支付宝 转账 转账 ,None
年轻 老 ,Love
哈哈 搞 晚 一点 ,Happiness
喜欢 大胆 喜欢 不留 遗憾 ,Love
兔死狐悲 物伤其类 ,Disgust
猜 准 ,None
说 演 德阳 情事 拍 糊照 敢 发 ,None
漂亮 ,Love
比较 穷 地方 线 ,None
不来 不来 废话 ,Disgust
男神 看 看 禁言 恨 新浪 好 忧伤 ,Sorrow
说 着急 回来 记得 直播 激励 我家 龟 ,None
爱 会 开心 死 ,Love
两只 猫 很 打架 到时候 猫 关系 不好 ,None
恩恩 嘿嘿嘿 表再 夸 ,Happiness
好好 好 吃 外星 料理 ! ! ,Love
毕业 大四 学生 喜欢 姑娘 ,None
发现 喜欢 大叔 级别 郭京飞 张嘉译 ,Love
抛弃 这么久 移情别恋 ,None
俩 私下 交流 啥时候 心愿 达成 ,None
傻 ,None
哈哈 厉害 ,Happiness
卧 曹 肥腻 腻 香肠 贴 琳姐 脸上 恶心 ,Disgust
好好 长大 ,None
地板 家具 深色 浅色 搞 北欧 浅灰 橡木 白 淡黄 之间 选 ,None
一种 得意 欣慰 感觉 ,None
说 几个 字 唱 ,None
睡衣 哈哈 ,Happiness
羡慕 嫉妒 恨 ,Love
快乐 大本营 好看 ,Love
希望 金主 爸爸 点 实质性 奖励 ,Love
喜欢 今生 第一次 秀智 ,Love
不行 朋友 撇 一撇 ,None
小样 送 好多 没忍 住 ,None
太 严肃 好玩 = = ,None
确实 选中 助手 很 荣幸 超级 轻松 ,Love
下水 非儿 冷 ,None
样子 厉害 ,Love
麻麻 看不见 单反 ,None
没生 懂 懂 事 谨慎 发言 ,Disgust
开心 活着 强 ,Happiness
扔 外面 生长 浇水 ,None
今儿 早点 睡 明天 精力 逛 哈哈 ,Happiness
我婷 说 休息 休息 上网 加班 事情 做 ,None
想 骗 买个 行李箱 ,Disgust
加油 输 程度 会 赢 哈哈哈哈 ,Happiness
亲 感谢您 支持 哦 ,Love
超级 好吃 双份 口味 披萨 撑死 我俩 我办 会员卡 下次 ,Love
落枕 ,None
行 少 少活 一年 ,Disgust
哈哈哈 哈哈哈 哈哈哈 这剧 真的 超 好看 ! 身边 看 ,Happiness
好多 人想 看 留点 机会 其他人 快 结束 再 碰碰运气 ,None
烦 很 ,Disgust
眉毛 流行 那种 韩国 粗平眉 一字眉 ,None
早 祝雪雪 天天 快乐 时时 愉快 ,Love
放心 原着 党 告诉 李世民 真 爱 长孙 ,None
圆滑 大人 多骗 几个 小妹妹 春夏秋冬 ,None
举办 室外 活动 地方 ,None
啊啊啊 壁咚 占有欲 棒棒 哒 想 所有人 ,Happiness
先谢 老板 咯 ,Happiness
齐人 好容易 下次 聚会 影返 张 反而 p 麻烦 ,None
能行 照片 ,None
希望 到时候 别疼 太长 最后 顺转 剖 我会 绝望 ,Fear
快 开 ,None
额 宽带 手机 流量 ,None
不太敢 穿 穿 显 肩宽 ,None
屎 咯 刚买 左边 ,None
支付宝 贷款 东西 罚款 ,None
坚定 选择 走 ,None
说 不好 想 ,None
知觉 血撒 油麦 菜 ,Sorrow
冯 花边新闻 太多 希望 丽颖 找到 真 爱 ,Love
盖盖 起来 超级 苦恼 收 花边 ,None
恩 见过 超级 帅 ,Love
无力 吐槽 两三天 健康 胖 哈哈 ,Happiness
昨天早上 不见 昨天 上班 找 ,Sorrow
办公室 没人 叻 ～ 前辈 总 跷 班会 打消 新 员工 上班 积极性 滴 ,Sorrow
哈 发神经 真的 会 剪掉 发型 很腻 ,Happiness
买 老 约翰 买 爆浆 酸奶 发现 好 好吃 ,Love
说来 一打 八 厘米 whatfor 买 几次 特别 好看 ,None
app 看 电视 看 求 解答 ,None
咿 喜欢 白 秋冬 袜子 买 买 ,Love
好 喜欢 卷度 烫 卷 ,Love
我念 大二 毕业 校园 里 放 吴奇隆 祝 一路顺风 老 伤感 毕业 时间 伤感 ,Sorrow
败 瞎说 说 战友 蓝 鲨 想查 查 ,Disgust
哇纯 友情 想 看 ,None
办法 好好 享受 拉 ,None
姐姐 喜欢 看 海报 关 事 ,Disgust
长 自然 亲 ,Disgust
哈哈哈 · · · 姑娘 太 逗 ,Happiness
真不知道 应该 检查 有没有 传染病 ,None
不靠 恋情 确实 别的 宣传 团队 能力 认的 比较清楚 ,Disgust
那好 合订 集 哈哈 ,Happiness
有钱赚 贵 硬通货 说 能切 不齐 ,None
种花 有味 咩 ,None
智齿 疼 拔 干 想象 哭 半个 点 ,Fear
好 别 纠结 真的 喜欢 追求 ,None
忘记 ,Sorrow
儿 忘艾特 挺 自觉 表扬 大振 小娟 过节 ,None
吃坏 肚子 拉稀 忧伤 故事 加班 当狗 ,None
昨天 难民 岛上 岛 感觉 还好 上岛 前 悲哀 海滩 ,Sorrow
噢 吃火锅 ,Happiness
点 没变 好久 生 ,None
死 大脑 变态 ,Disgust
特意 看 比有 变化 ,None
室友 买过 真的 好用 好奇 回家 那家 眉毛 补色 刚刚 补好 挺 自然 看 ～ ,Love
谢谢 哦 ,Happiness
喜欢 慌不择路 撞进 怀里 心里 样子 ,Love
授人 以鱼 授人以渔 区别 扯 意识形态 ,None
懒得 要死 ,Sorrow
下午 击穿 3480 - 3500 会 追空 反 抽 更好 ,None
即便如此 好 会计 哈哈哈 ,Happiness
奶奶 抱 全家人 ,None
那种 失去 闺蜜 痛 说 却 只能 男 名字 疼 ,Sorrow
说好 做 彼此 天使 ,None
早上 学校 老师 下午 学校 外教 ,None
恕 才疏学浅 花 ,None
有句 俗语 叫家 一老 如有 一宝 感觉 真的 很 贴切 ,Love
哈哈哈 哈哈 难上加难 男朋友 很难 阿泽 男朋友 更难 ,Happiness
好像 肩头 真 露 发 制服 照片 肩头 马赛克 ,None
没事 忙 ,None
哈哈 ,Happiness
明明 可爱 美食 博主 ,Love
谭 老师 您好 谭 老师 您 辛苦 ,None
新款 第二年 买 桌 ,None
视频 网站 下映 很快 会 ,None
想法 （ ） ,None
还好 还好 一年 想 香港 玩 找 ,None
嘻嘻 很 鸡 贼 发 平台 发 牢骚 ,Happiness
同类 疯子 ,None
彤彤 咳到 痴线 痛苦 ,Sorrow
吃 主食 会 胖丫 ,None
好 喜欢 赵丽颖 ,Love
哈哈 期待 期待 ! ! ,Happiness
最后 一张 貌似 说 西皮 ,None
最近 总是 做梦 梦到 好久不见 醒来 一阵 伤感 ,Sorrow
文字 为生 厉害 ,Love
田园 猫 三个 月 罐头 ,None
感觉 上次 好 太 ,Love
葡萄 好像 分为 尖叶 圆叶 喜欢 圆叶 ,Love
说 韩国 版 步步 惊心 刚刚 看 青春 派 好 喜欢 董子 健 ,Love
领导 莫愁 可恨 终有 可怜 时 ,Disgust
主楼 楼梯 ,None
绍兴 美 小编 机会 会 ,None
没事 吃 吃 死 ,None
开拍 明年 夏天 才播 ,Happiness
两家 电视台 采访 第三个 电视台 ,None
钓鱼 日子 过得 不错 窝 ,Love
卡布奇诺 不错 甜食 太甜 ,None
上班 是因为 变穷 两件 想 买 无奈 票票 ,Sorrow
哈哈 下次 好 ,Happiness
记得 会 头疼 胃疼 时间 应该 医院 还好 检查一下 问题 放心 光吃 止疼药 不行 ,None
眼神 这是 三岁 我哥家 我姐 两个 月 姐夫 出事 ,None
学校 安排 早就 通知 ,None
未 长大 系甘对 我家 姐 ,None
眼神 太 霸气 ,Love
感觉 妳 喜欢 家小 清清 ,Love
还好 吉林 韩建 盈利 俩 形态 比较 放心 说 周一 复盘 时 ,None
好 爱 哈哈 学长 表情 好 逗 ,Love
不好意思 转给 第一个 私 妹子 ,None
小太监 本妃 厉害 拖出去 打死 ,Disgust
顺利 毕业 学弟 加油 ～ ,Love
哈哈 生日快乐 好开心 ,Happiness
卖 ,None
一看 看 ,None
高中 时光 追 ,Sorrow
服务 ,None
说得对 必要 再 购置 一套 文具 ,None
当做 借口 ,None
中毒 ,None
说 前 10 机会 争点 排位 低 威胁 不到 ,None
哈哈 我妈 瞅 笑 出声 很 早就 看 医生 痘痘 真的 长 很多 ,Happiness
哈哈哈哈 我先 下单 烤串 再 淘宝 买买 高兴 把持 把持 不住 ,Happiness
隐瞒 多年 身高 之谜 解开 我儿 砸 ： 情愿 ,Sorrow
说 一场 点映 好像 看过 说 很 不错 样子 ,None
哈哈 我知 吖 系 讲 事实 ,Happiness
来来来 姐姐 别读 适合 读博 听 cc 说 老师 嫌弃 ,None
素质 配不上 老板 审计 公司 合伙人 ” 怎么回事 上网 百度 光彩 事 ,Disgust
好 玩 开心 ,None
开发新 地图 开发 留着 明年 ,None
富 二代 喜欢 懂 哈哈哈 ,Happiness
可怜 吃 瓜分 ,Sorrow
放心 没什么 牵挂 赶紧 ,Disgust
哈哈 小姐姐 弄 虚 说 做得好 ,Happiness
太惨 明晚 吃 泡面 ,Sorrow
说 趴 兴奋 睡不着 ,None
最起码 尊重 ,None
我会 积极响应 妳 倡议 ,None
这剧 好看 干嘛 王 阿姨 希望 年少时 能和帅 老师 谈恋爱 ,None
比较 瘦 快 教练 打击 死 喊 深 蹲 练腿 说 腿 太粗 ,Disgust
好 想 ,None
好 high 衣服 脱 ,None
请全 宿舍 喝 喜酒 咯 ,None
pomona 真的 太牛 同行 参观 包括 pomona 在内 claremont 五校 联盟 ～ scripps 超 漂亮 ～ 晚上 cmc ,Love
左边 选手 右边 主持人 观众 ,None
喜欢 白羊 宝宝 ,Love
好似 靓 d 喔 ,Love
最 喜欢 小岳岳 追车 这段 ,Love
没错 血雨腥风 包包 干脆 出道 做 营销 号 算了 ,None
莫须有 事情 承认 奇怪 ,Disgust
好 再 问问 哈 ,Happiness
啧啧 陪衬 不错 永远都是 二 逼 剪刀手 听说 习惯 哈 ,None
羡慕 书信 时代 一生 只够 爱 ,None
问题 当年 电视台 小编 怼 ,None
哈哈哈 最 喜欢 嗒 ～ ,Happiness
超 满足 嘻嘻 ,Happiness
农村 生活 ,Sorrow
家培哥 伤心 优秀 公司 舍不得 勒 开心 点 难 不到 加油 ,Love
气质 不符 ,None
下次 记到 娃儿 带到 不见 ,None
好 不瞒您说 看 ,None
我凯 禁欲 系转 偶像剧 心碎 成渣 渣 ,Sorrow
买 两本 没收 昨天 新华书店 想 先睹为快 查 电脑 说售空 ,None
幼儿园 杠 把子 敢 欺负 ,None
叶子 负责 美观 咩 ,None
中 分 很多年 ,None
a 股 故意 坑 毛病 先 兜里 几个 子儿 值不值得 惦记 ,Disgust
喜欢 男生 说 说不定 喜欢 ,Love
单身 汪来 报道 约会 吃 肉 ,None
含 香阁 情人节 开 ,None
本事 别 p 脸 ,None
明天 桂林 号 北海 见 几点 中午 ,None
没收 短信 通知 ,None
没理 激动 村子 里 老奶奶 八卦 下次 别 诬陷 关系户 怂 ,Disgust
一升 一升 ,None
明天 考研 却 影响 没水 想 骂人 想 睡着 ,Disgust
嫁 告诉 真的 家里 过年 ,None
喜欢 听到 前奏 想到 那群 青春 洋溢 机师 学员 tvb 辉煌 ,Love
会 ,None
哈哈哈 太忙 不用 回复 美女 妹妹 每次 评论 一一 回复 很 感动 很 开心 爱 哦 哒 ,Happiness
姐夫 好 食 住 饮 果餐 ,None
哈哈 早 早 ,Happiness
裁判 瞎 男排 土耳其 黑 一点 职业 精神 ,Disgust
喜欢 可爱 ,Love
我能 很 绝望 ,Sorrow
反骨 精是 特玉莲 某胧 月 远 美国 而来 说不上 胧 月 国内 好像 淡雪 ,None
看 ,None
p 孩 吃香 ,None
～ 我要 预定 ,None
有没有 20 集 以内 日剧 推荐 ,None
